1055,1,899,1453,Выполнение работ по техническому обслуживанию и ремонту автомобилей\, принадлежащих Татарстанской таможне в г. Казани.,1453,8000 р.,4000 р.,4000 р.,22.01.2010 09:20,
1056,1,900,1454,Дизельное топливо зимнее З-0\,2,1454,3347\,55 р.,334755 р.,334755 р.,15.01.2010 09:40,
1058,1,901,1458,Оказание охранных услуг в 2010 году,1458,15000 р.,300000 р.,300000 р.,22.01.2010 09:25,
1060,1,902,1460,текущий ремонт кафедры Организации здравоохранения 3 этаж ул. Бутлерова\, д.49б,1460,8500 р.,168250 р.,168250 р.,25.01.2010 10:30,
1061,1,903,1470,Охрана здания общежития Камской государственной академии физической культуры\, спорта и туризма.,1470,2917 р.,583460 р.,583460 р.,25.01.2010 10:45,
1061,2,904,1471,Охрана учебного здания Камской государственной академии физической культуры\, спорта и туризма.,1471,960 р.,192000 р.,192000 р.,25.01.2010 10:50,
1062,1,905,1462,Выполнение работ по техническому обслуживанию и ремонтуавтобусов и грузовых автомобилей\, принадлежащих Татарстанской таможне в г. Казани,1462,3500 р.,350000 р.,350000 р.,25.01.2010 10:35,
1063,1,906,1464,Выполнение работ по техническому обслуживанию и ремонту автомобилей\, принадлежащих Татарстанской таможне в г. Набережные Челны.,1464,5000 р.,500000 р.,500000 р.,25.01.2010 10:40,
1064,1,907,1465,Поставка офисной бумаги для нужд консерватории,1465,1400 р.,20440 р.,20440 р.,29.01.2010 09:00,
1065,1,908,1553,техническое обслуживание охранно-пожарной сигнализации,1553,35057\,55 р.,697645\,24 р.,697645\,24 р.,08.02.2010 09:40,
1066,1,909,1473,Хлеб и хлебобулочные изделия.,1473,1140 р.,38000 р.,38000 р.,25.01.2010 11:00,
1066,2,910,1474,Мука,1474,852 р.,28400 р.,28400 р.,25.01.2010 11:05,
1066,3,911,1475,Сухофрукты,1475,1500 р.,50000 р.,50000 р.,25.01.2010 11:10,
1066,4,912,1476,Крупы\, сахар\, макароны.,1476,4500 р.,150000 р.,150000 р.,25.01.2010 11:15,
1066,5,913,1477,Консервация овощная и плодово-ягодная.,1477,1860 р.,62000 р.,62000 р.,25.01.2010 11:20,
1066,6,914,1478,Молочная продукция,1478,4992 р.,166400 р.,166400 р.,25.01.2010 11:25,
1066,7,915,1480,Яйцо куриное I категории,1480,450 р.,15000 р.,15000 р.,25.01.2010 11:30,
1066,8,916,1481,Рыба и морепродукты пищевые,1481,1860 р.,62000 р.,62000 р.,25.01.2010 11:35,
1066,9,917,1483,Мясная продукция,1483,10500 р.,350000 р.,350000 р.,25.01.2010 11:40,
1066,10,918,1484,Колбасные изделия и копченности.,1484,1650 р.,55000 р.,55000 р.,25.01.2010 11:45,
1066,11,919,1485,Мясо птицы,1485,2250 р.,70250 р.,70250 р.,25.01.2010 11:50,
1066,12,920,1486,Сок\, упаковка 1 литр.,1486,2592 р.,85536 р.,85536 р.,25.01.2010 11:55,
1068,1,921,1482,оформление подписки периодических изданий в 2010 г,1482,40176 р.,803522\,84 р.,803522\,84 р.,25.01.2010 10:55,
1069,1,922,1487,Поставка рыбы свежемороженой (горбуша в количестве 2500 кг.\, минтай в количестве 100 кг.) и филе свежемороженого (филе пангасиуса в количестве 100 кг.) для обеспечения нужд "Казанского юридического института МВД России" (Подробная информация указана в Техническом задании),1487,1610 р.,322000 р.,322000 р.,28.01.2010 09:10,
1070,1,923,1488,Поставка лифтового оборудования на объект "Деревня Универсиады" жилого корпуса общежития 5А-3,1488,95500 р.,1514766 р.,1514766 р.,28.01.2010 12:00,
1071,1,924,1489,Поставка и монтаж активного сетевого оборудования,1489,4450 р.,885550 р.,885550 р.,28.01.2010 09:00,
1072,1,925,1491,Обновление эксплуатирующейся в Управлении Федеральной  службы Российской Федерации по контролю за оборотом наркотиков по Республике Татарстан справочно-правовой базы «ГАРАНТ».,1491,4618\,46 р.,92369\,15 р.,92369\,15 р.,25.01.2010 12:05,
1073,1,926,1490,Приобретение автотранспортного средства,1490,53500 р.,1070000 р.,1070000 р.,29.01.2010 09:15,
1074,1,927,1492,Поставка канцелярских товаров для нужд УФК по Республике Татарстан,1492,50000 р.,805000 р.,805000 р.,29.01.2010 09:05,
1075,1,928,1493,Приобретение материальных запасов для систем телекоммуникаций\, локальных вычислительных сетей и средств связи для нужд Управления Федеральной службы государственной регистрации\, кадастра и картографии по Республике Татарстан,1493,52000 р.,1034800 р.,1034800 р.,28.01.2010 09:05,
1076,1,929,1494,Поставка ГСМ,1494,56000 р.,1120000 р.,1120000 р.,28.01.2010 09:15,
1078,1,930,1496,«Выполнение работ по устройству приточно-вытяжной вентиляции в испытательной лаборатории нефтепродуктов ФГУ «Татарстанский центр стандартизации\, метрологии и сертификации в соответствии с документацией об аукционе,1496,16805 р.,1663695 р.,1663695 р.,01.02.2010 09:00,
1079,1,931,1497,Оказание услуг передачи данных (услуги Интернет),1497,65000 р.,1300000 р.,1300000 р.,25.01.2010 12:10,
1080,1,932,1498,поставка фруктов,1498,85050 р.,1814400 р.,1814400 р.,28.01.2010 09:25,
1081,1,933,1499,поставка хлеба,1499,10640\,7 р.,2128140 р.,2128140 р.,28.01.2010 09:30,
1082,1,934,1500,Поставка масла сливочного,1500,34020 р.,1128330 р.,1128330 р.,28.01.2010 09:35,
1083,1,935,1501,Выполнение планово-предупредительных работ на искусственных дорожных сооружениях на автомобильных дорогах общего пользования федерального значения  М-7 "Волга" - от Москвы через Владимир\, Нижний Новгород\, Казань до Уфы на участке км 735+204 – км 1166+710; Подъезды к городам Ижевск и Пермь  на участке км 0+000 – км 28+916; 1Р 175 Йошкар-Ола – Зеленодольск до магистрали «Волга» на участке км 95+118 – км 126+298 в Республике Татарстан.,1501,400000 р.,6800000 р.,6800000 р.,11.02.2010 09:00,
1084,1,936,1502,Выполнение планово-предупредительных работ на искусственных дорожных сооружениях на автомобильной дороге общего пользования федерального значения  1Р 241 Казань-Буинск-Ульяновск на участке км 0+000 – км 136+969 в Республике Татарстан.,1502,285000 р.,4031466 р.,4031466 р.,11.02.2010 09:05,
1087,1,937,1505,Выполнение планово-предупредительных работ на искусственных дорожных сооружениях на автомобильных дорогах общего пользования федерального значения "Вятка" - от Чебоксар через плотину Чебоксарской ГЭС на Йошкар-Олу\, Киров до Сыктывкара на участке км 19+008 – км 135+087; 1Р 175 Йошкар-Ола – Зеленодольск до магистрали «Волга» на участке  км 6+200 – км 95+014 в Республике Марий Эл.,1505,256000 р.,3839225 р.,3839225 р.,11.02.2010 09:10,
1088,1,938,1506,Выполнение планово-предупредительных работ на искусственных дорожных сооружениях на автомобильной дороге общего пользования федерального значения Казань – Оренбург на участке км 10+000 – км 399+065 в Республике Татарстан.,1506,50000 р.,684938 р.,684938 р.,11.02.2010 09:15,
1089,1,939,1507,Выполнение планово-предупредительных работ на искусственных дорожных сооружениях на автомобильных дорогах общего пользования федерального значения "Вятка" - от Чебоксар через плотину Чебоксарской ГЭС на Йошкар-Олу\, Киров до Сыктывкара на участке км 135+087 – км 501+504; Подъезд к г. Киров на участке км 0+000 – 15+000 в Кировской области.,1507,176000 р.,2006720 р.,2006720 р.,11.02.2010 09:20,
1090,1,940,1508,Выполнение планово-предупредительных работ на искусственных дорожных сооружениях на автомобильной дороге общего пользования федерального значения "Вятка" - от Чебоксар через плотину Чебоксарской ГЭС на Йошкар-Олу\, Киров до Сыктывкара на участке км 501+504 – км 785+136 в Республике Коми.,1508,300000 р.,6062067\,35 р.,6062067\,35 р.,11.02.2010 09:25,
1091,1,941,1509,Выполнение планово-предупредительных работ на искусственных дорожных сооружениях на автомобильной дороге общего пользования федерального значения М-7 "Волга" - от Москвы через Владимир\, Нижний Новгород\, Казань до Уфы. Подъезды к городам Ижевск и Пермь  на участке км 28+916 – км 337+201 в Удмуртской  Республике.,1509,460000 р.,6535800 р.,6535800 р.,18.02.2010 09:30,
1093,1,942,1512,Бензин автомобильный АИ-95 ГОСТ Р 51105-97 (ОКДП 2320212) - 15600 лбензин автомобильный АИ-92 ГОСТ Р 51105-97 (ОКДП 2320212) - 51500 лбензин автомобильный АИ-80 ГОСТ Р 51105-97 (ОКДП 2320212) - 56500 лтопливо дизельное ДТ ГОСТ 305-85 (ОКДП 2320232) - 20500 л,1512,149970\,5 р.,2999410 р.,2999410 р.,29.01.2010 09:25,
1094,1,943,1511,Поставка автотранспорта для перевозки людей модификации «микроавтобус» типа Fiat Dukato или «эквивалент»,1511,4994 р.,998800 р.,998800 р.,29.01.2010 09:20,
1095,1,944,1513,мясо-говядина 2 категории\, замороженное в полутушах и четвертинах по ГОСТ 779-55,1513,131712 р.,2528867\,6 р.,2528867\,6 р.,29.01.2010 09:30,
1098,1,945,1516,Поставка бумаги ВХИ марки типа «Г» или «эквивалент» формат 620 \, 80 гр/м 2.,1516,817 р.,163400 р.,163400 р.,01.02.2010 09:05,
1100,1,946,1518,поставка грузового автомобиля ГАЗ-3309 для учебного вождения,1518,6000 р.,600000 р.,600000 р.,01.02.2010 09:50,
1101,1,947,1519,Канцелярские товары.,1519,172\,5 р.,4400 р.,4400 р.,01.02.2010 09:10,
1101,2,948,1520,Канцелярские товары,1520,120 р.,3960 р.,3960 р.,01.02.2010 09:15,
1101,3,949,1521,Канцелярские товары,1521,105 р.,3500 р.,3500 р.,01.02.2010 09:20,
1102,1,950,1522,Оборудование учебно-лабораторное.,1522,19050 р.,635000 р.,635000 р.,01.02.2010 09:35,
1103,1,951,1523,Камера морозильная.,1523,600 р.,17100 р.,17100 р.,01.02.2010 09:40,
1104,1,952,1524,Посуда одноразовая.,1524,1440 р.,47760 р.,47760 р.,01.02.2010 09:25,
1105,1,953,1525,Аппарат телефонный.,1525,120 р.,4000 р.,4000 р.,01.02.2010 09:30,
1106,1,954,1526,Выполнение работ по капитальному ремонту линейно-кабельного хозяйства  учебных корпусов №2\,4.,1526,4170 р.,139000 р.,139000 р.,01.02.2010 09:45,
1108,1,955,1528,Услуги по обязательному страхованию гражданской ответственности владельцев транспортных средств,1528,25000 р.,500000 р.,500000 р.,11.02.2010 09:55,
1109,1,956,1529,Поставка расходных материалов для оргтехники на 2010 год,1529,40000 р.,796000 р.,796000 р.,04.02.2010 09:00,
1110,1,957,1530,Оказание услуг по охране объектов ГОУВПО КГУ с помощью кнопки тревожной сигнализации.,1530,19240 р.,384800 р.,384800 р.,04.02.2010 09:05,
1111,1,958,1531,Поставка оборудования для лаборатории клеевых технологий в рамках реализации Программы «Национальный исследовательский университет»  для Казанского государственного технического университета им. А.Н. Туполева на 2010 год,1531,12500 р.,1250000 р.,1250000 р.,04.02.2010 09:20,
1112,1,959,1532,Поставка оборудования для лаборатории вакуумной пропитки в рамках реализации Программы «Национальный исследовательский университет»  для Казанского государственного технического университета им. А.Н. Туполева на 2010 год.,1532,12000 р.,1200000 р.,1200000 р.,04.02.2010 09:15,
1114,1,960,1535,Предоставление услуг передачи данных,1535,235000 р.,4700000 р.,4700000 р.,18.02.2010 09:00,
1116,1,961,1536,Оказание услуг по очистке и замене ковровых покрытий,1536,25902 р.,518040 р.,518040 р.,04.02.2010 09:10,
1117,1,962,1537,Оказание услуг по обязательному страхованию автогражданской ответственности для нужд Отделения по г.Набережные Челны УФК по Республике Татарстан,1537,630 р.,12600 р.,12600 р.,04.02.2010 09:25,
1119,1,963,1539,Выполнение работ по ремонту моста через реку Пазелинка на км 187+467 автомобильной дороги М-7 "Волга" - от Москвы через Владимир\, Нижний Новгород\, Казань до Уфы Подъезды к городам Ижевск и Пермь в Удмуртской Республике.,1539,597000 р.,11950840 р.,11950840 р.,15.02.2010 09:05,
1120,1,964,1540,Выполнение работ по ремонту моста через реку Седка на км 588+387 автомобильной дороги "Вятка" - от Чебоксар через плотину Чебоксарской ГЭС на Йошкар-Олу\, Киров до Сыктывкара в Республике Коми,1540,1010000 р.,12427083\,6 р.,12427083\,6 р.,15.02.2010 09:10,
1121,1,965,1541,Оказание услуг по уборке\, погрузке\, вывозу и размещению снега на специализированном полигоне.,1541,1000 р.,100000 р.,100000 р.,05.02.2010 09:00,
1122,1,966,1542,Поставка канцелярских товаров,1542,10648 р.,1438250 р.,1438250 р.,05.02.2010 09:05,
1123,1,967,1543,Поставка хозяйственных товаров,1543,18456 р.,1845634\,6 р.,1845634\,6 р.,05.02.2010 09:10,
1124,1,968,1544,Оказание услуг по предоставлению доступа и использование каналов связи защищенной сети передачи данных\, объединяющей территориальные органы и подведомственные организации Управления Росреестра по Республике Татарстан,1544,61500 р.,1230000 р.,1230000 р.,05.02.2010 09:15,
1126,1,969,1546,Оказание услуг по изготовлению буклетов для ГОУ ВПО КГТУ,1546,17425 р.,343250 р.,343250 р.,08.02.2010 09:00,
1127,1,970,1547,Оказание услуг по изготовлению рекламных проспектов для ГОУ ВПО КГТУ,1547,5840 р.,116200 р.,116200 р.,08.02.2010 09:05,
1128,1,971,1549,Оказание услуг по комплексной уборке помещений,1549,27000 р.,540000 р.,540000 р.,08.02.2010 09:10,
1129,1,972,1550,Выполнение работ по ремонту федеральной автомобильной дороги "Вятка" - от Чебоксар через плотину Чебоксарской ГЭС на Йошкар-Олу\, Киров до Сыктывкара км 501+504 – км 508+504 в Республике Коми,1550,941000 р.,18834960 р.,18834960 р.,18.02.2010 09:05,
1130,1,973,1551,Выполнение работ по ремонту федеральной  автомобильной дороги "Вятка" - от Чебоксар через плотину Чебоксарской ГЭС на Йошкар-Олу\, Киров до Сыктывкара км 686 – км 691 в Республике Коми,1551,652000 р.,12926746\,8 р.,12926746\,8 р.,18.02.2010 09:10,
1131,1,974,2095,Поставка топлива согласно приложения №3 документации об аукционе Лот №1,2095,38433 р.,768660 р.,768660 р.,26.03.2010 11:00,
1131,2,975,2170,Поставка топлива согласно приложения №3 документации об аукционе Лот №2,2170,8443\,75 р.,168875 р.,168875 р.,26.03.2010 11:05,
1131,3,976,2171,Поставка топлива согласно приложения №3 документации об аукционе Лот №3,2171,11001 р.,220020 р.,220020 р.,26.03.2010 11:10,
1131,4,977,2172,Поставка топлива согласно приложения №3 документации об аукционе Лот №4,2172,17158 р.,343160 р.,343160 р.,26.03.2010 11:15,
1131,5,978,2173,Поставка топлива согласно приложения №3 документации об аукционе Лот №5,2173,83814\,25 р.,1676285 р.,1676285 р.,26.03.2010 11:20,
1131,6,979,2174,Поставка топлива согласно приложения №3 документации об аукционе Лот №6,2174,79097\,25 р.,1581945 р.,1581945 р.,26.03.2010 11:25,
1131,7,980,2175,Поставка топлива согласно приложения №3 документации об аукционе Лот №7,2175,46665\,5 р.,933310 р.,933310 р.,26.03.2010 11:30,
1131,8,981,2176,Поставка топлива согласно приложения №3 документации об аукционе Лот №8,2176,29809 р.,596180 р.,596180 р.,26.03.2010 11:35,
1131,9,982,2177,Поставка топлива согласно приложения №3 документации об аукционе Лот №9,2177,12031\,5 р.,240630 р.,240630 р.,26.03.2010 11:40,
1132,1,983,1554,Оказание услуг по ремонту автотранспорта,1554,50000 р.,1000000 р.,1000000 р.,08.02.2010 09:15,
1133,1,984,1555,Поставка запасных частей для автотранспорта,1555,75000 р.,1500000 р.,1500000 р.,11.02.2010 09:55,
1134,1,985,1556,Поставка канцелярских товаров,1556,25000 р.,402500 р.,402500 р.,08.02.2010 09:20,
1135,1,986,1557,Подписка на периодические издания для факультета журналистики и социологии,1557,2750 р.,55000 р.,55000 р.,08.02.2010 09:25,
1136,1,987,1558,Техническое обслуживание газового оборудования,1558,10120\,8 р.,202416 р.,202416 р.,08.02.2010 09:30,
1137,1,988,1559,Оказание услуг по комплексной уборке помещений и прилегающей территории для нужд Управления Федеральной службы государственной регистрации\, кадастра и картографии по Республике Татарстан,1559,300000 р.,6000000 р.,6000000 р.,19.02.2010 09:00,
1138,1,989,1560,Приобретение материальных запасов (бумаги) для нужд Управления Федеральной  службы государственной регистрации\, кадастра и картографии по Республике Татарстан,1560,150000 р.,2984858 р.,2984858 р.,08.02.2010 09:35,
1139,1,990,1561,Поставка лекарственных средств для нужд санатория-профилактория КГТУ им. А.Н.Туполева,1561,4999\,5 р.,499950 р.,499950 р.,08.02.2010 09:45,
1140,1,991,1562,Предоставление услуг по подключению и доступу к сети Интернет для Управления Федеральной службы Российской Федерации по контролю за оборотом наркотиков по Республике Татарстан на 2010 год.,1562,9600 р.,179520 р.,179520 р.,08.02.2010 09:50,
1141,1,992,1563,Изготовление бланочной продукции для нужд Управления Федеральной службы государственной регистрации\, кадастра и картографии по Республике Татарстан,1563,7500 р.,145500 р.,145500 р.,08.02.2010 09:55,
1142,1,993,1564,Техническое обслуживание и ремонт автомашин ВАЗ,1564,12500 р.,250000 р.,250000 р.,08.02.2010 10:00,
1143,1,994,1565,Бумага для офисной техники (тестовый аукцион),1565,1000 р.,10000 р.,10000 р.,27.01.2010 09:30,
1144,1,995,1566,Тест,1566,100 р.,5000 р.,5000 р.,27.01.2010 09:30,
1145,1,996,1567,Капитальный ремонт рекреаций\, расположенных на 4\, 5\, 6\, 7\, 8 этажах общежития № 4 по адресу: г. Казань\, ул. Зелёная\, 2.,1567,34000 р.,680000 р.,680000 р.,08.02.2010 10:05,
1145,2,997,1568,Капитальный ремонт лестничных клеток общежития № 4 по адресу: г. Казань\, ул. Зелёная\, 2,1568,28000 р.,560000 р.,560000 р.,08.02.2010 10:10,
1145,3,998,1569,Капитальный ремонт малых коридоров\, расположенных на 4\, 5\, 6\, 7\, 8 этажах общежития № 4 по адресу: г. Казань\, ул. Зелёная\, 2.,1569,43500 р.,865650 р.,865650 р.,08.02.2010 10:15,
1146,1,999,1570,Капитальный ремонт коридора\, кухни\, прачечной\, отдельной комнаты расположенных на 4\, 5\, 6\, 7\, 8 этажах общежития № 4 по адресу г.Казань\, ул. Зеленая\, 2.,1570,263000 р.,5260000 р.,5260000 р.,24.02.2010 09:00,
1146,2,1000,1571,Капитальный ремонт жилых блоков\, расположенных на 4\, 5\, 6\, 7\, 8 этажах общежития № 4 по адресу г.Казань\, ул. Зеленая\, 2,1571,797500 р.,15870250 р.,15870250 р.,24.02.2010 09:05,
1147,1,1001,1572,Капитальный ремонт фасада общежития № 4 по адресу г.Казань\, ул. Зеленая\, 2,1572,75000 р.,1500000 р.,1500000 р.,08.02.2010 10:20,
