76,1,1,109,выполнение работ по измерению и испытанию электрооборудования,109,791 р.,154243\,01 р.,154243\,01 р.,11.09.2009 09:10,
75,1,2,108,поставка стеллажей,108,47500 р.,950000 р.,950000 р.,10.09.2009 09:50,
79,1,3,111,поставка сенсорных информационных киосков,111,8000 р.,160000 р.,160000 р.,11.09.2009 09:15,
77,1,4,110,поставка сантехнических изделий,110,731\,39 р.,146276\,6 р.,146276\,6 р.,11.09.2009 09:05,
81,1,5,117,предоставление услуг по добровольному страхованию служебного автомобиля Нива Шевроле УФК по Республике Татарстан.,117,900 р.,18000 р.,18000 р.,17.09.2009 09:00,
78,1,6,112,Поставка проекционного оборудования,112,19500 р.,390000 р.,390000 р.,14.09.2009 09:10,
88,1,7,142,Поставка нефтепродуктов для нужд Филиала по Республике Татарстан ФГУ "ТФИ по Приволжскому федеральному округу",142,1673\,8 р.,33476 р.,33476 р.,11.09.2009 09:30,
84,1,8,118,поставка (приобретение) аппаратно-программного комплекса блокирования утечки информации по каналам связи  для нужд УФК по Республике Татарстан,118,17000 р.,340000 р.,340000 р.,14.09.2009 09:25,
86,1,9,123,поставка учебного лапароскопического оборудования,123,26475 р.,529500 р.,529500 р.,11.09.2009 09:20,
86,2,10,124,поставка учебного клинического оборудования,124,19000 р.,380000 р.,380000 р.,11.09.2009 09:25,
85,1,11,120,поставка расходных материалов для оргтехники,120,35000 р.,693000 р.,693000 р.,14.09.2009 09:15,
82,1,12,119,Предоставление услуг передачи данных и телематических служб.,119,7000 р.,140000 р.,140000 р.,14.09.2009 09:20,
98,1,13,149,Канцтовары : папка регистратор с арочным механизмом,149,200 р.,20000 р.,20000 р.,17.09.2009 09:05,
97,1,14,653,Бумага предназначенная для оргтехники: «SvetoCopy» или эквивалент,653,200 р.,19200 р.,19200 р.,20.11.2009 09:05,
99,1,15,151,Оказание услуг по изготовлению методических пособий для студентов.,151,3750 р.,75000 р.,75000 р.,14.09.2009 09:40,
100,1,16,152,Поставка бумаги и канцелярских товаров для нужд Управления Федеральной регистрационной службы по Республике Татарстан,152,11200 р.,147400 р.,147400 р.,17.09.2009 09:10,
92,1,17,160,Открытый аукцион на право заключения государственного контракта на ремонт кровли с заменой кровельного покрытиянад учебным корпусом ГОУ СПО «СКС».,160,120000 р.,2400000 р.,2400000 р.,14.09.2009 09:45,
95,1,18,147,сканер документный Fujitsu fi-5110c или эквивалент,147,300 р.,30000 р.,30000 р.,17.11.2009 09:05,
111,1,19,164,поставка мебели,164,32049 р.,640980 р.,640980 р.,14.09.2009 09:50,
109,1,20,162,поставка и ввод в эксплуатацию медицинской техники для медицинских учреждений РТ,162,525000 р.,10447500 р.,10447500 р.,05.10.2009 09:00,
101,1,21,153,выполнение работ по изгтовлению журналов регистрации и книг учета,153,1662\,52 р.,166252\,39 р.,166252\,39 р.,21.09.2009 09:00,
110,1,22,163,Ремонт двигателя легкового автомобиля Ford Mondeo,163,1471\,33 р.,147133 р.,147133 р.,11.09.2009 00:00,
108,1,23,161,Текущий ремонт кровли учебного здания.,161,7750 р.,155000 р.,155000 р.,18.09.2009 09:00,
113,1,24,166,текущий ремонт пожарного водопровода,166,21951\,98 р.,439039\,56 р.,439039\,56 р.,14.09.2009 09:55,
112,1,25,165,Ремонт двигателя легкового автомобиля Ford Mondeo,165,1471\,33 р.,147133 р.,147133 р.,11.09.2009 09:40,
116,1,26,169,поставка учебной литературы,169,3994\,15 р.,79883 р.,79883 р.,17.09.2009 09:15,
115,1,27,168,Оказание услуг по вывозу твердо-бытовых отходов (ТБО),168,10000 р.,200000 р.,200000 р.,18.09.2009 09:05,
114,1,28,167,поставка медикаментов,167,3875\,25 р.,77505 р.,77505 р.,14.09.2009 10:00,
118,1,29,172,Поставка бумаги для оргтехники,172,1300 р.,122900 р.,122900 р.,18.09.2009 09:10,
117,1,30,170,текущий ремонт аудитории,170,27257\,05 р.,515157\,78 р.,515157\,78 р.,17.09.2009 09:20,
117,2,31,171,текущий ремонт внутренних помещений,171,4500 р.,90000 р.,90000 р.,17.09.2009 09:25,
119,1,32,173,Оказание услуг по страхованию здания\, расположенного по адресу: РТ\, г. Казань\, ул. Ш. Марджани\, д. 28,173,40000 р.,266000 р.,266000 р.,24.09.2009 09:05,
122,1,33,176,поставка медицинского инструментария,176,4280 р.,85600 р.,85600 р.,18.09.2009 09:15,
137,1,34,206,поставка стоматологических материалов,206,6775\,95 р.,135519 р.,135519 р.,21.09.2009 09:10,
123,1,35,177,поставка сетевого оборудования и носителей информации,177,655\,85 р.,13117 р.,13117 р.,18.09.2009 09:20,
135,1,36,195,Покупка автомобилей для Управления Роспотребнадзора по Республике Татарстан (Татарстан).Автомобиль легковой Lada Samara ВАЗ-21144-20 "В",195,49000 р.,980000 р.,980000 р.,21.09.2009 09:05,
132,1,37,210,Поставка  автотранспортного средства для нужд УФК по Республике Татарстан,210,20825 р.,416500 р.,416500 р.,21.09.2009 09:20,
141,1,38,211,Поставка газовых котлов,211,6500 р.,130000 р.,130000 р.,25.09.2009 09:00,
143,1,39,214,по монтажу 8-ми секционных подъемных ворот «DoorHan» в гаражах филиала ФГУЗ «Центр гигиены и эпидемиологии в Республике Татарстан (Татарстан)» в Нижнекамском районе и г. Нижнекамск.,214,19100 р.,382000 р.,382000 р.,21.09.2009 09:35,
138,1,40,207,Поствка ГСМ (Бензин АИ-92),207,85020 р.,1700400 р.,1700400 р.,21.09.2009 09:15,
139,1,41,209,Поставка дизельного топлива,209,3870 р.,387000 р.,387000 р.,21.09.2009 09:30,
140,1,42,208,поставка медицинского оборудования,208,14732\,5 р.,294650 р.,294650 р.,21.09.2009 09:25,
151,1,43,222,Ремонт двигателя легкового автомобиля Ford Mondeo,222,1471\,33 р.,147133 р.,147133 р.,24.09.2009 09:15,
149,1,44,220,Выполнение работ по сносу самовольно возведенных строений на основании решения суда,220,9500 р.,190000 р.,190000 р.,28.09.2009 09:15,
146,1,45,217,Поставка офисной бумаги формата А4 – Ballet classic или эквивалент,217,9000 р.,179100 р.,179100 р.,22.09.2009 09:00,
144,1,46,215,по ремонту кабинета главного врача и системы вентиляции хим. лаборатории в здании филиала ФГУЗ «Центр гигиены и эпидемиологии в Республике Татарстан (Татарстан)» в Бугульминском районе и г. Бугульма (г. Бугульма\, ул. Ворошилова\,4),215,9000 р.,180000 р.,180000 р.,21.09.2009 09:45,
145,1,47,216,проведение текущего  ремонта сетей наружного теплоснабжения здания Советского районного суда г. Казани,216,17412\,9 р.,348258 р.,348258 р.,21.09.2009 09:40,
157,1,48,228,Выполнение работ по диагностике и оценке состояния участков автомобильных дорог общего пользования федерального значения Волго-Вятского региона по объекту: «Ремонт автомобильной дороги 1Р 175 «Йошкар-Ола - Зеленодольск» до магистрали «Волга» км 80+000-км 85+000 на территории Республики Марий Эл».,228,1240 р.,24825 р.,24825 р.,24.09.2009 09:25,
158,1,49,229,поставка сигнализатора загазованности,229,450 р.,9000 р.,9000 р.,21.09.2009 09:55,
156,1,50,227,Благоустройство территории стоянки для посетителей Авиастроительного районного суда г. Казани,227,16981\,35 р.,339627 р.,339627 р.,21.09.2009 09:50,
153,1,51,224,поставка нефтепродуктов для нужд Управления Федеральной  регистрационной  службы  по  Республике  Татарстан:- Бензин АИ-92 – 41 000 л;- Дизельное топливо ДТ – 6 000 л.,224,49999\,5 р.,999990 р.,999990 р.,28.09.2009 09:20,
155,1,52,226,Выполнение работ по диагностике и оценке состояния участков автомобильных дорог общего пользования федерального значения Волго-Вятского региона по объекту: «Ремонт автомобильной дороги 1Р 175 «Йошкар-Ола - Зеленодольск» до магистрали «Волга» км 75+000-км 80+000 на территории Республики Марий Эл».,226,1200 р.,24929 р.,24929 р.,24.09.2009 09:20,
162,1,53,234,Выполнение  капитального ремонта наружных сетей теплоснабжения и горячего водоснабжения общежития №3 КГТУ-КАИ по адресу: г. Казань\, ул. Кирпичникова\, 11,234,24490\,35 р.,484908\,92 р.,484908\,92 р.,24.09.2009 09:30,
159,1,54,230,поставка мягкой кровли гидроизол (или эквивалент),230,400 р.,8000 р.,8000 р.,25.09.2009 09:05,
160,1,55,231,Текущий ремонт Бавлинского городского суда Республики Татарстан,231,9240\,4 р.,184808 р.,184808 р.,21.09.2009 10:00,
161,1,56,232,Поставка автомобилей\, оборудованных средствами управления\, для застрахованных лиц\, получивших повреждение здоровья вследствие несчастных случаев на производстве и профессиональных заболеваний\, без левой руки и левой ноги .,232,32000 р.,680000 р.,680000 р.,28.09.2009 09:35,
161,2,57,233,Поставка автомобилей\, оборудованных средствами управления\, для застрахованных лиц\, получивших повреждение здоровья вследствие несчастных случаев на производстве и профессиональных заболеваний\, без правой  руки и правой ноги.,233,34000 р.,680000 р.,680000 р.,28.09.2009 09:40,
171,1,58,242,Оказание услуг по оценке рыночной стоимости годовой величины арендной платы за использование объектов недвижимости\, находящихся в собственности Российской Федераци,242,65690 р.,1064178 р.,1064178 р.,25.09.2009 09:10,
148,1,59,219,Закупка материальных запасов  для нужд Управления  Федеральной регистрационной службы по Республике ТатарстанКороба архивные в количестве 22 000 штук.,219,66000 р.,1306800 р.,1306800 р.,24.09.2009 09:10,
170,1,60,842,Поставка принтера,842,7500 р.,147500 р.,147500 р.,03.12.2009 09:35,
172,1,61,243,Поставка электротоваров  для нужд КГТУ-КАИ,243,3565\,5 р.,356550 р.,356550 р.,01.10.2009 09:00,
169,1,62,241,Предоставление услуг передачи данных и телематических служб.,241,700 р.,140000 р.,140000 р.,28.09.2009 09:30,
165,1,63,237,Поставка  товаров (расходные материалы) для нужд УФК по Республике Татарстан,237,25000 р.,272500 р.,272500 р.,28.09.2009 09:25,
175,1,64,246,«на  поставку  автомобилей LADA – 11183-34 Калина седан (или эквивалент) в количестве 2 штук для нужд Управления Федеральной службы по надзору в сфере природопользования по Республике Татарстан»,246,6100 р.,610000 р.,610000 р.,28.09.2009 09:55,
173,1,65,244,Поставка нефтепродуктов (бензин АИ-92\, АИ-95) для нужд Филиала по Республике Татарстан ФГУ "ТФИ по Приволжскому федеральному округу",244,1263\,9 р.,25278 р.,25278 р.,28.09.2009 09:45,
176,1,66,247,поставка оргтехники,247,8421 р.,167577 р.,167577 р.,28.09.2009 09:50,
177,1,67,248,Поставка канцелярских товаров,248,1750 р.,33825 р.,33825 р.,28.10.2009 09:00,
178,1,68,252,Поставка ГСМ для обеспечения деятельности подразделений Центра ГИМС МЧС России по Республике Татарстан,252,7000 р.,700000 р.,700000 р.,28.09.2009 10:10,
183,1,69,254,Расходные материалы для оргтехники (тонер-картриджи),254,13217\,5 р.,157000 р.,157000 р.,28.09.2009 10:05,
185,1,70,256,Оказание услуг по установке и наладке системы контроля и управления доступом (СКУД) в общежитиях КГТУ – КАИ №№ 1\, 5\, 6\, 7\, расположенных по адресам\, соответственно:  г. Казань\, ул. Большая Красная д. 7/9\, г.Казань\, ул. Н.Ершова д. 30\, г.Казань\, ул. Товарищеская\, д. 30\, г.Казань\, ул.Товарищеская\, д. 30а,256,22080 р.,2208000 р.,2208000 р.,23.11.2009 10:40,
186,1,71,257,Поставка легкового автомобиля для нужд Нижнекамского института информационных технологий и телекоммуникаций (филиал) КГТУ-КАИ,257,3260 р.,652000 р.,652000 р.,28.09.2009 10:15,
179,1,72,249,Поставка хозяйственных товаров,249,1750 р.,29050 р.,29050 р.,28.09.2009 10:00,
182,1,73,253,Поставка приборов учета тепловой энергии,253,32278\,13 р.,645562\,67 р.,645562\,67 р.,02.10.2009 09:00,
194,1,74,264,Поставка  автотранспортного средства - автомобиля ГАЗ-330231-216 - для нужд УФК по Республике Татарстан,264,20825 р.,416500 р.,416500 р.,02.10.2009 09:05,
190,1,75,260,Выполнение текущего ремонта системы вентиляции учебного корпуса №2  Зеленодольского филиала  КГТУ-КАИ,260,4615\,4 р.,461540 р.,461540 р.,02.10.2009 09:10,
195,1,76,265,поставка учебной литературы,265,3525 р.,70500 р.,70500 р.,05.10.2009 09:15,
189,1,77,259,Поставка бумажной продукции для нужд КГТУ-КАИ,259,4600 р.,380000 р.,380000 р.,01.10.2009 09:10,
199,1,78,267,Поставка мяса говядины\, охлажденного 1 категории в количестве 5 000 (пять тысяч) килограмм и печени говяжьей в количестве 250 (двести пятьдесят) килограмм\, охлажденной\, для обеспечения\, нужд "Казанского юридического института МВД России" (Подробная информация указана в Техническом  задании),267,4451\,25 р.,890250 р.,890250 р.,19.01.2010 09:00,
200,1,79,269,Поставка  оборудования для столовой и его установка в столовой очного отделения "Казанского юридического института МВД России" (подробная информация указана в "Техническом задании" документации об открытом аукционе в электронной форме),269,14700 р.,2910600 р.,2910600 р.,30.10.2009 09:25,
198,1,80,266,Поставка мяса говядины\, охлажденного 1 категории в количестве 5 000 (пять тысяч) килограмм и печени говяжьей в количестве 250 (двести пятьдесят) килограмм\, охлажденной\, для обеспечения\, нужд "Казанского юридического института МВД России" (Подробная информация указана в Техническом  задании),266,4451\,25 р.,885798\,75 р.,885798\,75 р.,28.01.2010 09:20,
204,1,81,273,поставка шкафов металлических\, согласно п.13 Документации,273,1000 р.,80000 р.,80000 р.,05.10.2009 09:15,
206,1,82,275,поставка расходных материалов и комплектующих для оргтехники,275,24972\,96 р.,496961 р.,496961 р.,05.10.2009 09:20,
210,1,83,279,по подготовке систем отопления  зданий ФГУЗ «Центр гигиены и эпидемиологии в Республике Татарстан (Татарстан)»к отопительному периоду 2009-2010 гг,279,9750 р.,195000 р.,195000 р.,09.10.2009 09:15,
208,1,84,277,поставка медицинских расходных материалов,277,12300 р.,246000 р.,246000 р.,05.10.2009 09:30,
211,1,85,280,на приобретение административно-лабораторного здания г. Арск,280,16800 р.,336000 р.,336000 р.,09.10.2009 09:10,
207,1,86,276,обслуживание водосчетчиков,276,4255\,35 р.,85107 р.,85107 р.,05.10.2009 09:35,
209,1,87,278,поставка химических реактивов,278,11495\,69 р.,229913\,8 р.,229913\,8 р.,05.10.2009 09:25,
217,1,88,698,Поставка\, монтаж и  ввод в эксплуатацию оборудования для центра дистанционных технологий\, центра создания электронных технологий и центра создания электронных учебников в рамках реализации программы «Национальный исследовательский университет» для Казанского государственного технического университета им. А.Н. Туполева на 2009 год.,698,31250 р.,3109375 р.,3109375 р.,03.12.2009 09:00,
213,1,89,282,покупка однокомнатной квартиры\, площадью 31\,0-33\,0 кв.м,282,45000 р.,900000 р.,900000 р.,09.10.2009 09:00,
213,2,90,283,покупка однокомнатной квартиры\, площадью 40\,0-42\,0 кв.м,283,55000 р.,1100000 р.,1100000 р.,09.10.2009 09:05,
212,1,91,281,поставка офисной бумаги,281,850 р.,69325 р.,69325 р.,08.10.2009 09:05,
216,1,92,286,Форменное обмундирование (мантии),286,10500 р.,210000 р.,210000 р.,12.10.2009 09:00,
220,1,93,297,Управление транспортными средствами,297,9250 р.,185000 р.,185000 р.,05.10.2009 09:40,
223,1,94,334,Поставка автомобиля,334,1460 р.,292000 р.,292000 р.,12.10.2009 09:20,
222,1,95,299,Костюм мужской,299,29580 р.,591600 р.,591600 р.,12.10.2009 09:05,
222,2,96,300,Костюм женский,300,9180 р.,183600 р.,183600 р.,12.10.2009 09:10,
221,1,97,298,Открытый аукцион на право заключения государственного контракта на устройство покрытия спортивной площадки,298,65000 р.,1312367 р.,1312367 р.,06.10.2009 09:00,
228,1,98,305,Поставка ГСМ для обеспечения деятельности подразделений Центра ГИМС МЧС России по Республике Татарстан,305,7000 р.,700000 р.,700000 р.,07.10.2009 09:05,
226,1,99,303,Поставка легкового автомобиля для нужд Нижнекамского института информационных технологий и телекоммуникаций (филиал) КГТУ-КАИ,303,3260 р.,652000 р.,652000 р.,07.10.2009 09:00,
230,1,100,307,Оказание услуг по техническому обслуживанию водопровода\, канализации и ливневой канализации Управления Федерального казначейства по Республике Татарстан,307,20500 р.,198850 р.,198850 р.,08.10.2009 09:10,
238,1,101,315,Оказание услуг по вывозу твердо-бытовых отходов (ТБО) из контейнеров с территорий Казанского юридического института МВД России с последующим его захоронением в объеме 1000 куб. м,315,1150 р.,143110 р.,143110 р.,23.12.2009 09:00,
240,1,102,323,Поставка\, выполнение монтажных и пуско-наладочных работ и обучение правилам эксплуатации спортивного оборудования,323,56700 р.,1890000 р.,1890000 р.,09.10.2009 09:30,
241,1,103,324,Поставка\, выполнение монтажных и пуско-наладочных работ и обучение правилам эксплуатации спортивного оборудования подросткового зала,324,42750 р.,1425000 р.,1425000 р.,09.10.2009 09:35,
237,1,104,314,Поставка рыбы свежемороженой (горбуша в количестве 2500 кг.\, минтай в количестве 100 кг.) и филе свежемороженого (филе пангасиуса в количестве 100 кг.) для обеспечения нужд "Казанского юридического института МВД России" (Подробная информация указана в Техническом задании),314,1610 р.,322000 р.,322000 р.,18.01.2010 11:50,
239,1,105,316,поставка\, выполнение монтажных и пуско-наладочных работ и обучение правилам эксплуатации спортивного оборудования,316,13500 р.,450000 р.,450000 р.,09.10.2009 09:45,
239,2,106,317,поставка\, выполнение монтажных и пуско-наладочных работ и обучение правилам эксплуатации спортивного оборудования,317,21000 р.,700000 р.,700000 р.,09.10.2009 09:50,
239,3,107,318,поставка\, выполнение монтажных и пуско-наладочных работ и обучение правилам эксплуатации спортивного оборудования,318,9000 р.,300000 р.,300000 р.,09.10.2009 09:55,
239,4,108,319,поставка\, выполнение монтажных и пуско-наладочных работ и обучение правилам эксплуатации спортивного оборудования,319,10200 р.,340000 р.,340000 р.,09.10.2009 10:00,
239,5,109,320,поставка\, выполнение монтажных и пуско-наладочных работ и обучение правилам эксплуатации спортивного оборудования,320,4800 р.,160000 р.,160000 р.,09.10.2009 10:05,
