2563,2,2917,3731,Оказание транспортных услуг по перевозке призывников от отдела военного комиссариата РТ по Камско-Устьинскому муниципальному образованию до сборного пункта РТ и обратно,3731,3612 р.,120400 р.,120400 р.,11.05.2010 12:50,
2564,1,2918,3732,Выполнение работ по ремонту кровли  в р.п. Аксубаево,3732,4325 р.,86500 р.,86500 р.,11.05.2010 12:55,
2565,1,2919,3741,Поставка  картриджей для лазерных принтеров Samsung ML-3051ND,3741,85000 р.,1691000 р.,1691000 р.,11.05.2010 09:00,
2566,1,2920,3733,Поставка комплектующих и оборудования для нужд УИТ СГТУ,3733,3500 р.,175000 р.,175000 р.,20.05.2010 09:20,
2567,1,2921,3738,Поставка горюче-смазочных материалов для нужд Управления вневедомственной охраны при УВД по городу Самаре в 3 квартале 2010 года,3738,145650 р.,2898000 р.,2898000 р.,17.05.2010 11:25,
2568,1,2922,3734,поставка летнего дизельного топлива  на теплоходы в районе города Набережные Челны Республики Татарстан,3734,3000 р.,516000 р.,516000 р.,17.05.2010 11:15,
2568,2,2923,3735,поставка летнего дизельного топлива на теплоходы\, находящиеся на участке р.Кама от города Сарапула Удмуртской Республики до населенного пункта Менделеевск Республики Татарстан,3735,11500 р.,1920500 р.,1920500 р.,21.05.2010 11:20,
2569,1,2924,3736,Выполнение работ по текущему ремонту помещений здания в г. Нурлат,3736,7750 р.,148765 р.,148765 р.,11.05.2010 09:05,
2570,1,2925,3737,поставка медицинских расходных материалов.,3737,5250 р.,105000 р.,105000 р.,17.05.2010 11:35,
2571,1,2926,3740,Реконструкция внешних сетей электроснабжения УПФР в г. Куйбышеве и Куйбышевском районе  Новосибирской области,3740,28130 р.,562600 р.,562600 р.,17.05.2010 11:30,
2572,1,2927,3742,Выполнение работ по ремонту системы электроснабжения в г. Бавлы,3742,4925 р.,98500 р.,98500 р.,11.05.2010 09:10,
2573,1,2928,3743,Поставка вычислительной техники,3743,18565 р.,334000 р.,334000 р.,10.05.2010 10:10,
2574,1,2929,3744,Выполнение работ по ремонту кровли здания памятника архитектуры республиканского (Республики Татарстан) значения-дома Тупицына с мезонином в г. Казани,3744,36500 р.,726350 р.,726350 р.,11.05.2010 09:15,
2575,1,2930,3745,Выполнение работ по текущему ремонту помещений здания в г. Лениногорск,3745,21500 р.,430000 р.,430000 р.,11.05.2010 09:20,
2577,1,2931,3746,Поставка в  2010 году кресел -колясок комнатных для взрослых с ручным приводом от обода колеса  для обеспечения пострадавших от несчастных случаев на производстве и профзаболеваний.,3746,5172 р.,103440 р.,103440 р.,14.05.2010 11:40,
2577,2,2932,3747,Поставка в 2010 году кресел-колясок прогулочных для взрослых с ручным приводом от обода колеса для обеспечения  пострадавших от несчастых случаев на производстве и профзаболеваний.,3747,2160 р.,43200 р.,43200 р.,14.05.2010 11:45,
2577,3,2933,3748,Поставка в 2010 году кресел-стульев с санитарным оснащением активного типа для обеспечения пострадавших от несчастных случаев на производстве и профзаболеваний.,3748,840 р.,16800 р.,16800 р.,14.05.2010 11:50,
2577,4,2934,3749,Поставка в 2010 году кресел-колясок с электроприводом универсальных для обеспечения  пострадавших от несчастных случаев на производстве и профзаболеваний.,3749,3150 р.,63000 р.,63000 р.,14.05.2010 11:55,
2577,5,2935,3750,Поставка в 2010 году кресел-колясок прогулочных с рычажным приводом для взрослых  для обеспечения  пострадавших от несчастных случаев на производстве и профзаболеваний.,3750,2640 р.,52800 р.,52800 р.,14.05.2010 12:00,
2577,6,2936,3751,Поставка в 2010 году кресел-колясок  активного типа  для обеспечения  пострадавших от  несчастных случаев на производстве и профзаболеваний.,3751,925 р.,18500 р.,18500 р.,14.05.2010 12:05,
2577,7,2937,3752,Поставка в 2010 году кресел-колясок  активного типа (изготовленных с использованием облегченных материалов) для обеспечения  пострадавших от несчастных случаев на производстве и профзаболеваний.,3752,2730 р.,54600 р.,54600 р.,14.05.2010 12:10,
2578,1,2938,3753,Выполнение подрядных работ на объекте: «Реконструкция охранного периметра с полным комплексом ИТСО ФГУП «Краснозаводский химический завод»,3753,2250000 р.,45000000 р.,45000000 р.,31.05.2010 09:00,
2579,1,2939,3754,Поставка вещевого имущества для договорных подразделений ФПС по Республике Татарстан,3754,245925 р.,4892500 р.,4892500 р.,24.05.2010 09:45,
2580,1,2940,3757,Выполнение работ по капитальному ремонту здания Управления Пенсионного фонда Российской Федерации в г. Агидель Республики Башкортостан,3757,251130 р.,4443354 р.,4443354 р.,24.05.2010 09:40,
2581,1,2941,3755,Приобретение материальных запасов (огнетушителей) для нужд Управления Федеральной  службы государственной регистрации\, кадастра и картографии по Республике Татарстан,3755,6100 р.,122000 р.,122000 р.,14.05.2010 12:15,
2583,1,2942,3758,Поставка дизельного топлива высшего сорта (летнего) для нужд ГУФСИН России по Пермскому краю,3758,965000 р.,19300000 р.,19300000 р.,27.05.2010 09:10,
2584,1,2943,3760,Поставка изделий медицинского назначения: тест - полосок,3760,880 р.,88000 р.,88000 р.,11.05.2010 09:30,
2584,2,2944,3761,Поставка изделий медицинского назначения: реагентов для ИФА,3761,400 р.,40000 р.,40000 р.,11.05.2010 09:35,
2584,3,2945,3762,Поставка изделий медицинского назначения: реагентов для общеклинических исследований,3762,3190 р.,319000 р.,319000 р.,11.05.2010 09:40,
2584,4,2946,3763,Поставка изделий медицинского назначения: реагентов для иммунохимии,3763,2480 р.,248000 р.,248000 р.,11.05.2010 09:45,
2584,5,2947,3764,Поставка изделий медицинского назначения: реагентов для биохимии,3764,12370 р.,1237000 р.,1237000 р.,11.05.2010 09:50,
2584,6,2948,3765,Поставка изделий медицинского назначения: расходных материалов для диагностики,3765,4930 р.,493000 р.,493000 р.,11.05.2010 09:55,
2585,1,2949,3766,Выполнение работ по комплексному капитальному ремонту 2-й очереди здания Государственного учреждения – Управления Пенсионного Фонда Российской Федерации по Смидовичскому  району Еврейской автономной области\, расположенного по адресу: 679150\, ЕАО\, п.Смидович\, ул.30 лет Победы\,20а,3766,135000 р.,2700000 р.,2700000 р.,17.05.2010 11:45,
2586,1,2950,3767,Выполнение работ по капитальному ремонту помещений административного здания УПФР в г. Петропавловске-Камчатском Камчатского края (общестроительные работы)  по адресу: 683031\, Камчатский край\, г. Петропавловск-Камчатский\, пр. Карла Маркса\, 37,3767,417040\,05 р.,8340801 р.,8340801 р.,27.05.2010 09:05,
2587,1,2951,3768,Поставщик обязуется передать в собственность Заказчику узлы для лазерных принтеров (далее "товар") согласно спецификации\, прилагаемой к контракту в качестве неотъемлемой части. Заказчик обязуется принять товар и оплатить его в порядке и на условиях\, предусмотренных настоящим Контрактом.,3768,45000 р.,460000 р.,460000 р.,17.05.2010 11:50,
2588,1,2952,3769,Поставка оборудования и комплектующих для нужд ЭФ и САДИ  СГТУ,3769,27200 р.,1353200 р.,1353200 р.,24.05.2010 09:50,
2589,1,2953,3770,Поставка компьютерной техники,3770,6550 р.,122790 р.,122790 р.,17.05.2010 12:50,
2591,1,2954,4043,Поставка крупы\, сахара и макаронных изделий,4043,260 р.,26000 р.,26000 р.,31.05.2010 12:50,
2592,1,2955,3772,Поставка технических средств защиты информации от несанкционированного доступа на ПЭВМ – средств аутентификации пользователей (электронных ключей) для Отделения ПФР по Ростовской области,3772,50000 р.,1000000 р.,1000000 р.,17.05.2010 12:10,
2593,1,2956,3771,Капитальный ремонт помещений УПФР в Чановском районе Новосибирской области по адресу: Новосибирская область\, р.п. Чаны\, ул. Комсомольская\, 12,3771,85000 р.,1700000 р.,1700000 р.,17.05.2010 11:55,
2594,1,2957,3773,Поставка лекарственных средств (прочие средства).,3773,5425 р.,1085000 р.,1085000 р.,14.05.2010 12:20,
2597,1,2958,3777,Выполнение работ по капитальному ремонту административного здания и гаража Государственного учреждения - Управления Пенсионного фонда Российской Федерации в Хотынецком районе Орловской области,3777,76722\,35 р.,1534447 р.,1534447 р.,17.05.2010 12:00,
2598,1,2959,3775,выполнение работ  по капитальному ремонту административных зданий МВД по Чувашии,3775,5 р.,1651000 р.,1651000 р.,14.05.2010 12:25,
2599,1,2960,3778,на поставку продуктов питания в детский оздоровительный лагерь «Огонек» ГУ «ГГИ» в период летнего сезона 2010 года. Лот № 1. БАКАЛЕЯ И КОНДИТЕРСКИЕ ИЗДЕЛИЯ,3778,13000 р.,271606\,2 р.,271606\,2 р.,17.05.2010 12:25,
2599,2,2961,3781,на поставку продуктов питания в детский оздоровительный лагерь «Огонек» ГУ «ГГИ» в период летнего сезона 2010 года. Лот № 2. МОЛОКО И МОЛОЧНЫЕ ПРОДУКТЫ,3781,25000 р.,507720 р.,507720 р.,17.05.2010 12:30,
2599,3,2962,3783,на поставку продуктов питания в детский оздоровительный лагерь «Огонек» ГУ «ГГИ» в период летнего сезона 2010 года. Лот № 3. МЯСО\, МЯСНЫЕ ПРОДУКТЫ И РЫБА\, РЫБНЫЕ КОНСЕРВЫ,3783,35000 р.,798680\,3 р.,798680\,3 р.,17.05.2010 12:35,
2599,4,2963,3784,на поставку продуктов питания в детский оздоровительный лагерь «Огонек» ГУ «ГГИ» в период летнего сезона 2010 года. Лот № 4. ОВОЩИ/ФРУКТЫ КОНСЕРВИРОВАННЫЕ\, СУШЕНЫЕ\, КВАШЕННЫЕ И СОЛЕНЫЕ,3784,4000 р.,86450\,4 р.,86450\,4 р.,17.05.2010 12:40,
2600,1,2964,3779,ремонт  отопительной и канализационной систем\, системы горячего и холодного водоснабжения памятника истории и культуры\, включая работы по восстановлению эффективного функционирования этих систем.,3779,342850 р.,6857000 р.,6857000 р.,27.05.2010 09:15,
2601,1,2965,3780,Выполнение работ по выборочному ремонту здания пожарного депо специализированной части по тушению крупных пожаров № 20,3780,65050 р.,1301000 р.,1301000 р.,17.05.2010 12:15,
2602,1,2966,3782,Автомобиль TOYOTA Hiace или эквивалент,3782,12600 р.,1260000 р.,1260000 р.,17.05.2010 12:05,
2603,1,2967,3785,Поставка моторного масла М-14В2 на теплоходы\, находящиеся на участке реки Кама от города Сарапула Удмуртской Республики до населенного пункта Менделеевск Республики Татарстан.,3785,2100 р.,420000 р.,420000 р.,17.05.2010 12:20,
2604,1,2968,3786,Проведение открытого аукциона в электронной форме на право заключения государственного контракта на поставку бумаги для нужд ГУ-Главного правления ПФР №3 по г.Москве и Московской области,3786,87000 р.,2900000 р.,2900000 р.,14.05.2010 12:30,
2605,1,2969,3787,Поставка «Комплекса аппаратно-программного для медицинских исследований на базе хроматографа «Хроматэк-Кристалл 5000» или эквивалент.,3787,7400 р.,740000 р.,740000 р.,20.05.2010 09:30,
2606,1,2970,3788,Капитальный ремонт помещений административного здания ГУ – Отдела Пенсионного фонда РФ по Кадомскому району Рязанской области – 180\,8 кв.м.,3788,68\,9 р.,1377\,9 р.,1377\,9 р.,19.05.2010 09:15,
2608,1,2971,3797,Поставка реагентов для анализатора Кобас  Интегра 400+  для  Федерального государственного учреждения здравоохранения «Медико-санитарная часть №172 Федерального медико-биологического агентства»,3797,22965\,32 р.,459306\,48 р.,459306\,48 р.,14.05.2010 09:05,
2609,1,2972,3790,Осуществление строительного контроля за объектом: Расходы на мероприятия по повышению уровня обустройства автомобильных дорог федерального значения. Устройство искусственного электроосвещения на автомобильной дороге М-7 «Волга» от Москвы через Владимир\, Нижний Новгород\, Казань до Уфы на участке км 776+700 – км 777+000 в Республике Татарстан,3790,7000 р.,151260 р.,151260 р.,17.05.2010 12:35,
2610,1,2973,3791,Осуществление строительного контроля за объектом: Расходы на мероприятия по повышению уровня обустройства автомобильных дорог федерального значения. Устройство искусственного электроосвещения на автомобильной дороге М-7 «Волга» - от Москвы через Владимир\, Нижний Новгород\, Казань до Уфы на участке км 782+800 – км 786+000 в Республике Татарстан,3791,25000 р.,504216 р.,504216 р.,17.05.2010 12:40,
2611,1,2974,3792,Осуществление строительного контроля за объектом: Расходы на мероприятия по повышению уровня обустройства автомобильных дорог федерального значения. Устройство искусственного электроосвещения на автомобильной дороге Казань - Оренбург км 160+174 – км 161+873 н.п. Азеево в Республике Татарстан,3792,7000 р.,151260 р.,151260 р.,17.05.2010 12:55,
2612,1,2975,3793,Осуществление строительного контроля за объектом: Расходы на мероприятия по повышению уровня обустройства автомобильных дорог федерального значения. Устройство искусственного электроосвещения на автомобильной дороге Казань - Оренбург км 181+800 – км 183+700 н.п. Ерыклы в Республике Татарстан,3793,7000 р.,151260 р.,151260 р.,17.05.2010 12:50,
2613,1,2976,3794,Осуществление строительного контроля за объектом: Расходы на мероприятия по повышению уровня обустройства автомобильных дорог федерального значения. Устройство искусственного электроосвещения на автомобильной дороге Казань - Оренбург км 374+900 – км 375+400 н.п. Урустамак в Республике Татарстан,3794,1700 р.,35300 р.,35300 р.,17.05.2010 12:45,
2614,1,2977,3796,Кузовной ремонт и окраска автомобилей,3796,894\,48 р.,89447\,98 р.,89447\,98 р.,17.05.2010 12:55,
2615,1,2978,3795,Осуществление строительного контроля за объектом: Устройство искусственного электроосвещения на автомобильной дороге М-7 «Волга» - от Москвы через Владимир\, Нижний Новгород\, Казань до Уфы на участках км 795+300 – км 796+600 н.п. Новониколаевский\, км 852+000 – км 855+000 н.п. Шали\, км 1070+800 –   км 1071+600 н.п. Сосновый Бор\, км 1079+100 – км 1080+700 н.п. Кузембетьево\, Республика Татарстан (2\, 3  пусковые  комплексы).,3795,26000 р.,525860 р.,525860 р.,17.05.2010 09:00,
2617,1,2979,3799,Оказание услуг по проживанию федеральных судей районных (городских) судов Республики Татарстан,3799,22500 р.,450000 р.,450000 р.,11.05.2010 10:00,
2618,1,2980,3800,выполнение работ по выборочному ремонту административного здания\, Карачаево-Черкесская Республика\, ул. Ленина\, 272 А,3800,105000 р.,2100000 р.,2100000 р.,14.05.2010 09:10,
2619,1,2981,3801,На право подписания государственного контракта на выполнение работ по комплексному капитальному ремонту объектов недвижимости Управления ПФР в Нюрбинском улусе (районе),3801,284000 р.,5680000 р.,5680000 р.,31.05.2010 09:05,
2620,1,2982,3802,Поставка легковых автомобилей.,3802,8750 р.,1750000 р.,1750000 р.,14.05.2010 09:15,
2622,1,2983,3803,Поставка запасных частей и расходных материалов для средств вычислительной техники,3803,38969\,45 р.,779388\,92 р.,779388\,92 р.,17.05.2010 09:00,
2623,1,2984,3804,право заключить государственный контракт на поставку форменной одежды для нужд Управления Россельхознадзора по Хабаровскому краю\, Еврейской автономной и Сахалинской областям,3804,90000 р.,1800000 р.,1800000 р.,17.05.2010 09:05,
2624,1,2985,3805,Поставка расходных материалов для средств вычислительной техники,3805,89750 р.,1785988 р.,1785988 р.,17.05.2010 09:10,
2625,1,2986,3806,Поставка канцелярских товаров,3806,10500 р.,210000 р.,210000 р.,17.05.2010 09:20,
2626,1,2987,3807,капитальный ремонт помещений учебного корпуса №1,3807,15000 р.,2985000 р.,2985000 р.,03.06.2010 09:00,
2628,1,2988,3809,Поставка «Мобильной малогабаритной установки групповой автоматической поверки электросчетчиков»,3809,5500 р.,550000 р.,550000 р.,21.05.2010 09:25,
2629,1,2989,3810,Изготовление печатной продукции,3810,15371\,5 р.,305890 р.,305890 р.,17.05.2010 09:25,
2630,1,2990,3811,выполнение работ по Капитальному ремонту  вентиляционных систем  лабораторного корпуса   Института биологии Коми научного центра  УрО РАН  в г.Сыктывкаре (коридор цокольного этажа),3811,102843 р.,2056861 р.,2056861 р.,20.05.2010 09:35,
2631,1,2991,3812,проведение капитального ремонта помещений Управления Пенсионного фонда Российской Федерации (государственного учреждения) в Чердынском районе Пермского края,3812,21350 р.,424865 р.,424865 р.,17.05.2010 09:35,
2632,1,2992,3813,Выполнение работ по капитальному ремонту здания УПФР в Тарском районе по адресу:Омская область\,г.Тара\,ул.Дзержинского\,7,3813,231100 р.,3376890 р.,3376890 р.,28.05.2010 09:10,
2633,1,2993,3814,Выполнение работ по комплексному капитальному ремонту помещений УПФР в Курманаевском районе Оренбургской области,3814,101390 р.,2027800 р.,2027800 р.,21.05.2010 09:30,
2634,1,2994,3815,Оказание услуг в области информационных технологий: техническое сопровождение и администрирование программных средств интернет-портала для нужд Управления Федеральной службы государственной регистрации\, кадастра и картографии по Республике Татарстан,3815,12500 р.,250000 р.,250000 р.,17.05.2010 09:15,
2635,1,2995,3816,на поставку картриджей и тонеров для принтеров Государственного учреждения – Отделения Пенсионного фонда Российской Федерации  по Тюменской области.,3816,113468\,75 р.,849000 р.,849000 р.,20.05.2010 09:40,
